<?xml version="1.0" encoding="UTF-8"?>
<BeeTable xmlns="http://www.butent.com/bee" xmlns:xsi="http://www.w3.org/2001/XMLSchema-instance"
  xsi:schemaLocation="http://www.butent.com/bee ../../../../schemas/table.xsd"

  name="CalendarReminders"
  idName="CalendarReminderID"
  >
  <BeeFields>
    <BeeField name="Calendar" type="LONG" notNull="true" relation="Calendars" cascade="DELETE" />
    <BeeField name="ReminderType" type="LONG" notNull="true" relation="ReminderTypes" cascade="DELETE" />
    <BeeField name="Minutes" type="INTEGER" />
  </BeeFields>
  <BeeKeys>
    <BeeKey unique="true">
      <KeyField>Calendar</KeyField>
      <KeyField>ReminderType</KeyField>
    </BeeKey>
  </BeeKeys>
</BeeTable>
